{
  "schema_version": "communication-catalog/gc5-s7",
  "catalog_id": "communication-catalog/gc5-s7",
  "slice_id": "gc5-s7",
  "authority": "docs/GC5-S7-CHANNEL.md",
  "rfc": "rfcs/RFC-0065-org-channel.md",
  "extends": "communication-catalog/gc5-s6",
  "verb": "MESSAGE",
  "new_verbs": [],
  "new_events": [],
  "surface": "CHANNEL",
  "channel_verb": false,
  "watch_channel": false,
  "help_channel": false,
  "leak_membership": false,
  "hidden_channel": false,
  "retention": 1,
  "board_retention": 5,
  "shout_retention": 1,
  "notice_retention": 1,
  "fail_unknown": "not_addressable",
  "fail_outsider": "not_addressable",
  "cost_compute": 1
}
